,Movie_Name,Year_of_Release,C_Rating,Watch_Time_(min),Genre,Movie_Rating,Metascore,Votes,Gross_($M),Description
412,High Noon,1952,PG,85,"Drama, Thriller, Western            ",8.0,89        ,106636,9.45,"A town Marshal, despite the disagreements of his newlywed bride and the townspeople around him, must face a gang of deadly killers alone at ""high noon"" when the gang leader, an outlaw he ""sent up"" years ago, arrives on the noon train."
413,Castle in the Sky,1986,PG,125,"Animation, Adventure, Family            ",8.0,78        ,171310,,A young boy and a girl with a magic crystal must race against pirates and foreign agents in a search for a legendary floating castle.
414,Pink Floyd: The Wall,1982,R,95,"Drama, Fantasy, Music            ",8.0,47        ,82815,22.24,A confined but troubled rock star descends into madness in the midst of his physical and social isolation from everyone.
415,8½,1963,Not Rated,138,Drama            ,8.0,93        ,120870,0.05,A harried movie director retreats into his memories and fantasies.
416,Wings of Desire,1987,PG-13,128,"Drama, Fantasy, Romance            ",8.0,79        ,73233,3.33,"An angel tires of his purely ethereal life of merely overseeing the human activity of Berlin's residents, and longs for the tangible joys of physical existence when he falls in love with a mortal."
417,Mommy,2014,R,139,Drama            ,8.0,74        ,58987,3.49,"A widowed single mother, raising her violent son alone, finds new hope when a mysterious neighbor inserts herself into their household."
418,La Dolce Vita,1960,Not Rated,174,"Comedy, Drama            ",8.0,95        ,75326,19.52,A series of stories following a week in the life of a philandering tabloid journalist living in Rome.
419,The Cabinet of Dr. Caligari,1920,Not Rated,67,"Horror, Mystery, Thriller            ",8.0,,66383,,"Hypnotist Dr. Caligari uses a somnambulist, Cesare, to commit murders."
420,The Legend of 1900,1998,R,169,"Drama, Music, Romance            ",8.0,58        ,66399,0.26,"A baby boy discovered on an ocean liner in 1900 grows into a musical prodigy, never setting foot on land."
421,The Straight Story,1999,G,112,"Biography, Drama            ",8.0,86        ,92943,6.20,An old man makes a long journey by lawnmower to mend his relationship with an ill brother.
422,Touch of Evil,1958,PG-13,95,"Crime, Drama, Film-Noir            ",8.0,99        ,106733,2.24,"A stark, perverse story of murder, kidnapping and police corruption in a Mexican border town."
423,The Night of the Hunter,1955,Not Rated,92,"Crime, Drama, Film-Noir            ",8.0,97        ,92063,0.65,"A religious fanatic marries a gullible widow whose young children are reluctant to tell him where their real daddy hid the $10,000 he'd stolen in a robbery."
424,Mirror,1975,Not Rated,107,"Biography, Drama            ",8.0,82        ,48960,0.18,"A dying man in his forties remembers his past. His childhood, his mother, the war, personal moments and things that tell of the recent history of all the Russian nation."
425,Anatomy of a Murder,1959,Not Rated,161,"Drama, Mystery            ",8.0,95        ,68225,11.90,"An upstate Michigan lawyer defends a soldier who claims he killed an innkeeper due to temporary insanity after the victim raped his wife. What is the truth, and will he win his case?"
426,Wolfwalkers,2020,PG,103,"Animation, Action, Adventure            ",8.0,87        ,34839,,A young apprentice hunter and her father journey to Ireland to help wipe out the last wolf pack. But everything changes when she befriends a free-spirited girl from a mysterious tribe rumored to transform into wolves by night.
427,Infernal Affairs,2002,R,101,"Action, Crime, Drama            ",8.0,75        ,127329,0.17,"A story between a mole in the police department and an undercover cop. Their objectives are the same: to find out who is the mole, and who is the cop."
428,The Hustler,1961,Not Rated,134,"Drama, Sport            ",8.0,90        ,83991,8.28,An up-and-coming pool player plays a long-time champion in a single high-stakes match.
429,The Tale of The Princess Kaguya,2013,PG,137,"Animation, Drama, Family            ",8.0,89        ,49405,1.51,"Found inside a shining stalk of bamboo by an old bamboo cutter and his wife, a tiny girl grows rapidly into an exquisite young lady. The mysterious young princess enthralls all who encounter her, but ultimately she must confront her fate, the punishment for her crime."
430,The Leopard,1963,PG,186,"Drama, History            ",8.0,100        ,27214,,"The Prince of Salina, a noble aristocrat of impeccable integrity, tries to preserve his family and class amid the tumultuous social upheavals of 1860s Sicily."
431,Fitzcarraldo,1982,PG,158,"Adventure, Drama            ",8.0,,36340,,"The story of Brian Sweeney Fitzgerald, an extremely determined man who intends to build an opera house in the middle of a jungle."
432,Elite Squad,2007,R,115,"Action, Crime, Drama            ",8.0,33        ,106512,0.01,"In 1997 Rio de Janeiro, Captain Nascimento has to find a substitute for his position while trying to take down drug dealers and criminals before the Pope visits."
433,My Sassy Girl,2001,Not Rated,137,"Comedy, Drama, Romance            ",8.0,,49193,,"A young man sees a drunk, cute woman standing too close to the tracks at a metro station in Seoul and pulls her back. She ends up getting him into trouble repeatedly after that, starting on the train."
434,Song of the Sea,2014,PG,93,"Animation, Adventure, Drama            ",8.0,85        ,60382,0.86,"Ben, a young Irish boy, and his little sister Saoirse, a girl who can turn into a seal, go on an adventure to free the fairies and save the spirit world."
435,The Sea Inside,2004,PG-13,126,"Biography, Drama            ",8.0,74        ,83270,2.09,"The factual story of Spaniard Ramon Sampedro, who fought a 28-year campaign in favor of euthanasia and his own right to die."
436,Persepolis,2007,PG-13,96,"Animation, Biography, Drama            ",8.0,90        ,96913,4.45,A precocious and outspoken Iranian girl grows up during the Islamic Revolution.
437,Nobody Knows,2004,PG-13,141,Drama            ,8.0,88        ,29284,0.68,"In a small Tokyo apartment, twelve-year-old Akira must care for his younger siblings after their mother leaves them and shows no sign of returning."
438,Out of the Past,1947,Not Rated,97,"Crime, Drama, Film-Noir            ",8.0,85        ,38778,,"A private eye escapes his past to run a gas station in a small town, but his past catches up with him. Now he must return to the big city world of danger, corruption, double crosses, and duplicitous dames."
439,The Diving Bell and the Butterfly,2007,PG-13,112,"Biography, Drama            ",8.0,92        ,108803,5.99,The true story of Elle editor Jean-Dominique Bauby who suffers a stroke and has to live with an almost totally paralyzed body; only his left eye isn't paralyzed.
440,Sleuth,1972,PG,138,"Mystery, Thriller            ",8.0,,48746,4.08,"A man who loves games and theater invites his wife's lover to meet him, setting up a battle of wits with potentially deadly results."
441,Le Samouraï,1967,GP,101,"Crime, Drama            ",8.0,,53394,0.04,After professional hitman Jef Costello is seen by witnesses his efforts to provide himself an alibi drive him further into a corner.
442,"Quo Vadis, Aida?",2020,,101,"Drama, History, War            ",8.0,97        ,35613,,"Aida is a translator for the UN in the small town of Srebrenica. When the Serbian army takes over the town, her family is among the thousands of citizens looking for shelter in the UN camp."
443,"Spring, Summer, Fall, Winter... and Spring",2003,R,103,"Drama, Romance            ",8.0,85        ,84644,2.38,A boy is raised by a Buddhist monk in an isolated floating temple where the years pass like the seasons.
444,Nostalghia,1983,Not Rated,125,Drama            ,8.0,,28333,0.01,"A Russian poet and his interpreter travel to Italy researching the life of an 18th-century composer, and instead meet a ruminative madman who tells the poet how the world may be saved."
445,Stalag 17,1953,Not Rated,120,"Comedy, Drama, War            ",8.0,84        ,56989,,"After two Americans are killed while escaping from a German P.O.W. camp in World War II, the barracks black marketeer, J.J. Sefton, is suspected of being an informer."
446,Brief Encounter,1945,Not Rated,86,"Drama, Romance            ",8.0,92        ,41732,,"Meeting a stranger in a railway station, a woman is tempted to cheat on her husband."
447,Dilwale Dulhania Le Jayenge,1995,Not Rated,181,"Drama, Romance            ",8.0,,72793,,"When Raj meets Simran in Europe, it isn't love at first sight but when Simran moves to India for an arranged marriage, love makes its presence felt."
448,Departures,2008,PG-13,130,Drama            ,8.0,68        ,53257,1.50,A newly unemployed cellist takes a job preparing the dead for funerals.
449,La strada,1954,Not Rated,108,Drama            ,8.0,,64666,,"A care-free girl is sold to a traveling entertainer, consequently enduring physical and emotional pain along the way."
450,Ivan's Childhood,1962,Not Rated,95,"Drama, War            ",8.0,,37950,,"During WWII, Soviet orphan Ivan Bondarev strikes up a friendship with three sympathetic Soviet officers while working as a scout behind the German lines."
451,"Black Cat, White Cat",1998,R,127,"Comedy, Crime, Romance            ",8.0,73        ,55038,0.35,Matko and his son Zare live on the banks of the Danube river and get by through hustling and basically doing anything to make a living. In order to pay off a business debt Matko agrees to marry off Zare to the sister of a local gangster.
452,Cries & Whispers,1972,R,91,Drama            ,8.0,,35347,1.74,"When a woman dying of cancer in early twentieth-century Sweden is visited by her two sisters, long-repressed feelings between the siblings rise to the surface."
453,"Goodbye, Children",1987,PG,104,"Drama, War            ",8.0,88        ,34841,4.54,"A French boarding school run by priests seems to be a haven from World War II until a new student arrives. Occupying the next bed in the dormitory to the top student in his class, the two young boys begin to form a bond."
454,The Wild Pear Tree,2018,,188,Drama            ,8.0,86        ,25490,0.03,"An unpublished writer returns to his hometown after graduating, where he seeks sponsors to publish his book while dealing with his father's deteriorating indulgence into gambling."
455,The Exterminating Angel,1962,Not Rated,95,"Drama, Fantasy            ",8.0,,34074,,The guests at an upper-class dinner party find themselves unable to leave.
456,Elite Squad 2: The Enemy Within,2010,Not Rated,115,"Action, Crime, Drama            ",8.0,71        ,84606,0.10,"After a prison riot, former-Captain Nascimento, now a high ranking security officer in Rio de Janeiro, is swept into a bloody political dispute that involves government officials and paramilitary groups."
457,Kind Hearts and Coronets,1949,Not Rated,106,"Comedy, Crime            ",8.0,,38424,,A distant poor relative of the Duke D'Ascoyne plots to inherit the title by murdering the eight other heirs who stand ahead of him in the line of succession.
458,"Rome, Open City",1945,Not Rated,103,"Drama, Thriller, War            ",8.0,,27579,,"During the Nazi occupation of Rome in 1944, the Resistance leader, Giorgio Manfredi, is chased by the Nazis as he seeks refuge and a way to escape."
459,The Shop Around the Corner,1940,Not Rated,99,"Comedy, Drama, Romance            ",8.0,96        ,35362,0.20,"Two employees at a gift shop can barely stand each other, without realizing that they are falling in love through the post as each other's anonymous pen pal."
460,Haider,2014,Not Rated,160,"Action, Crime, Drama            ",8.0,,55983,0.90,"A young man returns to Kashmir after his father's disappearance to confront his uncle, whom he suspects of playing a role in his father's fate."
461,Central Station,1998,R,110,Drama            ,8.0,80        ,40750,5.60,"The emotive journey of a former schoolteacher who writes letters for illiterate people, and a young boy whose mother has just died, as they search for the father he never knew."
462,G.O.R.A.,2004,,127,"Adventure, Comedy, Sci-Fi            ",8.0,,64436,,A slick young Turk kidnapped by extraterrestrials shows his great « humanitarian spirit » by outwitting the evil commander-in-chief of the planet of G.O.R.A.
463,Sanjuro,1962,Not Rated,96,"Action, Drama, Thriller            ",8.0,,39334,,"A crafty samurai helps a young man and his fellow clansmen trying to save his uncle, who has been framed and imprisoned by a corrupt superintendent."
464,Tae Guk Gi: The Brotherhood of War,2004,R,140,"Action, Drama, War            ",8.0,64        ,40313,1.11,"When two brothers are forced to fight in the Korean War, the elder decides to take the riskiest missions if it will help shield the younger from battle."
465,Andaz Apna Apna,1994,Not Rated,160,"Action, Comedy, Romance            ",8.0,,54136,,Two slackers competing for the affections of an heiress inadvertently become her protectors from an evil criminal.
466,Winter Light,1963,Not Rated,81,Drama            ,8.0,,25882,,A small-town priest struggles with his faith.
467,"Carry On, Munna Bhai",2006,Not Rated,144,"Comedy, Drama, Romance            ",8.0,,48101,2.22,Munna Bhai embarks on a journey with Mahatma Gandhi in order to fight against a corrupt property dealer.
468,Vizontele,2001,,110,"Comedy, Drama            ",8.0,,37608,,"Lives of residents in a small, Anatolian village change when television is introduced to them."
469,Special 26,2013,Not Rated,144,"Crime, Drama, Thriller            ",8.0,,57389,1.08,A gang of con-men rob prominent rich businessmen and politicians by posing as C.B.I and income tax officers.
470,The Breath,2009,,128,"Action, Drama, Thriller            ",8.0,,34343,,Story of 40-man Turkish task force who must defend a relay station.
471,Everything Everywhere All at Once,2022,R,139,"Action, Adventure, Comedy            ",7.9,81        ,438342,72.86,A middle-aged Chinese immigrant is swept up into an insane adventure in which she alone can save existence by exploring other universes and connecting with the lives she could have led.
472,Puss in Boots: The Last Wish,2022,PG,102,"Animation, Adventure, Comedy            ",7.9,73        ,124177,168.46,"When Puss in Boots discovers that his passion for adventure has taken its toll and he has burned through eight of his nine lives, he launches an epic journey to restore them by finding the mythical Last Wish."
473,Titanic,1997,PG-13,194,"Drama, Romance            ",7.9,75        ,1215965,659.33,"A seventeen-year-old aristocrat falls in love with a kind but poor artist aboard the luxurious, ill-fated R.M.S. Titanic."
474,Knives Out,2019,PG-13,130,"Comedy, Crime, Drama            ",7.9,82        ,724044,165.36,"A detective investigates the death of the patriarch of an eccentric, combative family."
475,Avatar,2009,PG-13,162,"Action, Adventure, Fantasy            ",7.9,83        ,1339158,760.51,A paraplegic Marine dispatched to the moon Pandora on a unique mission becomes torn between following his orders and protecting the world he feels is his home.
476,Mulholland Drive,2001,R,147,"Drama, Mystery, Thriller            ",7.9,86        ,365746,7.22,"After a car wreck on the winding Mulholland Drive renders a woman amnesiac, she and a perky Hollywood-hopeful search for clues and answers across Los Angeles in a twisting venture beyond dreams and reality."
477,All the President's Men,1976,PG,138,"Drama, History, Thriller            ",7.9,84        ,119693,70.60,"""The Washington Post"" reporters Bob Woodward and Carl Bernstein uncover the details of the Watergate scandal that leads to President Richard Nixon's resignation."
478,Arrival,2016,PG-13,116,"Drama, Mystery, Sci-Fi            ",7.9,81        ,715844,100.55,A linguist works with the military to communicate with alien lifeforms after twelve mysterious spacecraft appear around the world.
479,The Bourne Identity,2002,PG-13,119,"Action, Mystery, Thriller            ",7.9,68        ,557533,121.66,"A man is picked up by a fishing boat, bullet-riddled and suffering from amnesia, before racing to elude assassins and attempting to regain his memory."
480,Boogie Nights,1997,R,155,Drama            ,7.9,85        ,272022,26.40,"Back when sex was safe, pleasure was a business and business was booming, an idealistic porn producer aspires to elevate his craft to an art when he discovers a hot young talent."
481,Iron Man,2008,PG-13,126,"Action, Adventure, Sci-Fi            ",7.9,79        ,1078756,318.41,"After being held captive in an Afghan cave, billionaire engineer Tony Stark creates a unique weaponized suit of armor to fight evil."
482,Harry Potter and the Prisoner of Azkaban,2004,PG,142,"Adventure, Family, Fantasy            ",7.9,82        ,653271,249.36,"Harry Potter, Ron and Hermione return to Hogwarts School of Witchcraft and Wizardry for their third year of study, where they delve into the mystery surrounding an escaped prisoner who poses a dangerous threat to the young wizard."
483,Shrek,2001,PG,90,"Animation, Adventure, Comedy            ",7.9,84        ,697338,267.67,"A mean lord exiles fairytale creatures to the swamp of a grumpy ogre, who must go on a quest and rescue a princess for the lord in order to get his land back."
484,The Perks of Being a Wallflower,2012,PG-13,103,Drama            ,7.9,67        ,524954,17.74,An introvert freshman is taken under the wings of two seniors who welcome him to the real world.
485,Jojo Rabbit,2019,PG-13,108,"Comedy, Drama, War            ",7.9,58        ,407904,33.37,A young German boy in the Hitler Youth whose hero and imaginary friend is the country's dictator is shocked to discover that his mother is hiding a Jewish girl in their home.
486,Fantastic Mr. Fox,2009,PG,87,"Animation, Adventure, Comedy            ",7.9,83        ,243633,21.00,An urbane fox cannot resist returning to his farm raiding ways and then must help his community survive the farmers' retaliation.
487,Almost Famous,2000,R,122,"Adventure, Comedy, Drama            ",7.9,90        ,282876,32.53,A high-school boy in the early 1970s is given the chance to write a story for Rolling Stone magazine about an up-and-coming rock band as he accompanies them on their concert tour.
488,Bohemian Rhapsody,2018,PG-13,134,"Biography, Drama, Music            ",7.9,49        ,554012,216.43,"The story of the legendary British rock band Queen and lead singer Freddie Mercury, leading up to their famous performance at Live Aid (1985)."
489,In Bruges,2008,R,107,"Comedy, Crime, Drama            ",7.9,67        ,444070,7.76,"Guilt-stricken after a job gone wrong, hitman Ray and his partner await orders from their ruthless boss in Bruges, Belgium, the last place in the world Ray wants to be."
490,Edge of Tomorrow,2014,PG-13,113,"Action, Adventure, Sci-Fi            ",7.9,71        ,696942,100.21,"A soldier fighting aliens gets to relive the same day over and over again, the day restarting every time he dies."
491,True Romance,1993,R,119,"Crime, Drama, Romance            ",7.9,59        ,232613,12.28,"In Detroit, a lonely pop culture geek marries a call girl, steals cocaine from her pimp, and tries to sell it in Hollywood. Meanwhile, the owners of the cocaine, the Mob, track them down in an attempt to reclaim it."
492,Children of Men,2006,R,109,"Action, Drama, Sci-Fi            ",7.9,84        ,510443,35.55,"In 2027, in a chaotic world in which women have somehow become infertile, a former activist agrees to help transport a miraculously pregnant woman to a sanctuary at sea."
493,E.T. the Extra-Terrestrial,1982,PG,115,"Adventure, Family, Sci-Fi            ",7.9,91        ,419653,435.11,A troubled child summons the courage to help a friendly alien escape from Earth and return to his home planet.
494,Star Trek,2009,PG-13,127,"Action, Adventure, Sci-Fi            ",7.9,82        ,609572,257.73,The brash James T. Kirk tries to live up to his father's legacy with Mr. Spock keeping him in check as a vengeful Romulan from the future creates black holes to destroy the Federation one planet at a time.
495,Thor: Ragnarok,2017,PG-13,130,"Action, Adventure, Comedy            ",7.9,74        ,772282,315.06,"Imprisoned on the planet Sakaar, Thor must race against time to return to Asgard and stop Ragnarök, the destruction of his world, at the hands of the powerful and ruthless villain Hela."
496,Shaun of the Dead,2004,R,99,"Comedy, Horror            ",7.9,76        ,569785,13.54,"The uneventful, aimless lives of a London electronics salesman and his layabout roommate are disrupted by the zombie apocalypse."
497,Mystic River,2003,R,138,"Crime, Drama, Mystery            ",7.9,84        ,466530,90.14,The lives of three men who were childhood friends are shattered when one of them has a family tragedy.
498,Wonder,2017,PG,113,"Drama, Family            ",7.9,66        ,169764,132.42,"Based on the New York Times bestseller, this movie tells the incredibly inspiring and heartwarming story of August Pullman, a boy with facial differences who enters the fifth grade, attending a mainstream elementary school for the first time."
499,The Ten Commandments,1956,G,220,"Adventure, Drama, Family            ",7.9,,74159,93.74,"Moses, raised as a prince of Egypt in the Pharaoh's household, learns of his true heritage as a Hebrew and his divine mission as the deliverer of his people from slavery."
500,X-Men: Days of Future Past,2014,PG-13,132,"Action, Adventure, Sci-Fi            ",7.9,75        ,723551,233.92,The X-Men send Wolverine to the past in a desperate effort to change history and prevent an event that results in doom for both humans and mutants.
501,District 9,2009,R,112,"Action, Sci-Fi, Thriller            ",7.9,81        ,693405,115.65,Violence ensues after an extraterrestrial race forced to live in slum-like conditions on Earth finds a kindred spirit in a government agent exposed to their biotechnology.
502,Carlito's Way,1993,R,144,"Crime, Drama, Thriller            ",7.9,66        ,223845,36.95,"A Puerto Rican former convict, just released from prison, pledges to stay away from drugs and violence despite the pressure around him and lead on to a better life outside of N.Y.C."
503,Life of Pi,2012,PG,127,"Adventure, Drama, Fantasy            ",7.9,79        ,643742,124.99,"A young man who survives a disaster at sea is hurtled into an epic journey of adventure and discovery. While cast away, he forms an unexpected connection with another survivor: a fearsome Bengal tiger."
504,Dallas Buyers Club,2013,R,117,"Biography, Drama            ",7.9,77        ,499102,27.30,"In 1985 Dallas, electrician and hustler Ron Woodroof works around the system to help AIDS patients get the medication they need after he is diagnosed with the disease."
505,The Blues Brothers,1980,R,133,"Action, Adventure, Comedy            ",7.9,60        ,205366,57.23,"Jake Blues rejoins with his brother Elwood after being released from prison, but the duo has just days to reunite their old R&B band and save the Catholic home where the two were raised, outrunning the police as they tear through Chicago."
506,Edward Scissorhands,1990,PG-13,105,"Drama, Fantasy, Romance            ",7.9,74        ,501570,56.36,The solitary life of an artificial man - who was incompletely constructed and has scissors for hands - is upended when he is taken in by a suburban family.
507,Marriage Story,2019,R,137,"Drama, Romance            ",7.9,94        ,323103,2.00,Noah Baumbach's incisive and compassionate look at a marriage breaking up and a family staying together.
508,Boyhood,2014,R,165,Drama            ,7.9,100        ,359533,25.38,"The life of Mason, from early childhood to his arrival at college."
509,Bound by Honor,1993,R,180,"Crime, Drama            ",7.9,47        ,32550,4.50,"Based on the true life experiences of poet Jimmy Santiago Baca, the film focuses on step-brothers Paco and Cruz, and their bi-racial cousin Miklo."
510,Once Were Warriors,1994,R,102,"Crime, Drama            ",7.9,77        ,35386,2.20,A family descended from Maori warriors is bedeviled by a violent father and the societal problems of being treated as outcasts.
511,This Is Spinal Tap,1984,R,82,"Comedy, Music            ",7.9,92        ,142526,4.74,"Spinal Tap, one of England's loudest bands, is chronicled by film director Marty DiBergi on what proves to be a fateful tour."
512,The Man from Earth,2007,Not Rated,87,"Drama, Fantasy, Mystery            ",7.9,,192131,,An impromptu goodbye party for Professor John Oldman becomes a mysterious interrogation after the retiring scholar reveals to his colleagues he has a longer and stranger past than they can imagine.
513,"Crouching Tiger, Hidden Dragon",2000,PG-13,120,"Action, Adventure, Drama            ",7.9,94        ,275144,128.08,A young Chinese warrior steals a sword from a famed swordsman and then escapes into a world of romantic adventure with a mysterious man in the frontier of the nation.
514,Toy Story 2,1999,G,92,"Animation, Adventure, Comedy            ",7.9,88        ,593786,245.85,"When Woody is stolen by a toy collector, Buzz and his friends set out on a rescue mission to save Woody before he becomes a museum toy property with his roundup gang Jessie, Prospector, and Bullseye."
515,Brazil,1985,R,132,"Drama, Sci-Fi            ",7.9,84        ,204669,9.93,A bureaucrat in a dystopic society becomes an enemy of the state as he pursues the woman of his dreams.
516,The Wrestler,2008,R,109,"Drama, Sport            ",7.9,80        ,312388,26.24,"A faded professional wrestler must retire, but finds his quest for a new life outside the ring a dispiriting struggle."
517,The Searchers,1956,Passed,119,"Adventure, Drama, Western            ",7.9,94        ,92312,,An American Civil War veteran embarks on a years-long journey to rescue his niece from the Comanches after the rest of his brother's family is massacred in a raid on their Texas farm.
