,Movie_Name,Year_of_Release,C_Rating,Watch_Time_(min),Genre,Movie_Rating,Metascore,Votes,Gross_($M),Description
725,Duck Soup,1933,Not Rated,69,"Comedy, Musical            ",7.8,93        ,61325,,"Rufus T. Firefly is named the dictator of bankrupt Freedonia and declares war on neighboring Sylvania over the love of his wealthy backer Mrs. Teasdale, contending with two inept spies who can't seem to keep straight which side they're on."
726,"I, Daniel Blake",2016,R,100,Drama            ,7.8,78        ,61871,0.26,"After surviving a heart-attack, a 59-year-old carpenter must fight bureaucratic forces to receive Employment and Support Allowance."
727,The Lunchbox,2013,PG,104,"Drama, Romance            ",7.8,76        ,57943,4.23,A mistaken delivery in Mumbai's famously efficient lunchbox delivery system connects a young housewife to an older man in the dusk of his life as they build a fantasy world together through notes in the lunchbox.
728,Batman: Mask of the Phantasm,1993,PG,76,"Animation, Action, Adventure            ",7.8,65        ,53285,5.62,Batman is wrongly implicated in a series of murders of mob bosses actually done by a new vigilante assassin.
729,The Lady Vanishes,1938,Not Rated,96,"Mystery, Thriller            ",7.8,98        ,54589,,"While travelling in continental Europe, a rich young playgirl realizes that an elderly lady seems to have disappeared from the train."
730,The Asphalt Jungle,1950,Passed,112,"Crime, Drama, Film-Noir            ",7.8,85        ,28416,,"A major heist goes off as planned, but then double crosses, bad luck and solid police work cause everything to unravel."
731,Cowboy Bebop: The Movie,2001,TV-14,115,"Animation, Action, Crime            ",7.8,61        ,50501,1.00,"A terrorist explosion releases a deadly virus on the masses, and it's up to the bounty-hunting Bebop crew to catch the cold-blooded culprit."
732,The Discreet Charm of the Bourgeoisie,1972,PG,102,Comedy            ,7.8,93        ,44672,0.20,"A surreal, virtually plotless series of dreams centered around six middle-class people and their consistently interrupted attempts to have a meal together."
733,You Can't Take It with You,1938,Passed,126,"Comedy, Drama, Romance            ",7.8,,26732,4.66,"The son of a snobbish Wall Street banker becomes engaged to a woman from a good-natured but decidedly eccentric family, not realizing that his father is trying to force her family from their home for a real estate development."
734,His Girl Friday,1940,Passed,92,"Comedy, Drama, Romance            ",7.8,,60648,0.30,A newspaper editor uses every trick in the book to keep his ace reporter ex-wife from remarrying.
735,Millennium Actress,2001,PG,87,"Animation, Drama, Fantasy            ",7.8,70        ,29618,0.19,A TV interviewer and his cameraman meet a former actress and travel through her memories and career.
736,The Chorus,2004,PG-13,97,"Comedy, Drama, Music            ",7.8,56        ,64422,3.64,The new teacher at a severely administered boys' boarding school works to positively affect the students' lives through music.
737,The Umbrellas of Cherbourg,1964,Not Rated,91,"Drama, Musical, Romance            ",7.8,86        ,29026,0.03,A young woman separated from her lover by war faces a life-altering decision.
738,"Like Father, Like Son",2013,Not Rated,121,Drama            ,7.8,73        ,26328,0.28,"Ryota is a successful workaholic businessman. When he learns that his biological son was switched with another boy after birth, he faces the difficult decision to choose his true son or the boy he and his wife have raised as their own."
739,The Killer,1989,R,111,"Action, Crime, Drama            ",7.8,82        ,49485,,A disillusioned assassin accepts one last hit in hopes of using his earnings to restore vision to a singer he accidentally blinded.
740,The Postman,1994,PG,108,"Biography, Comedy, Drama            ",7.8,81        ,37581,21.85,"A simple Italian postman learns to love poetry while delivering mail to a famous poet, and then uses this to woo local beauty Beatrice."
741,Vivre Sa Vie,1962,Not Rated,85,Drama            ,7.8,,33365,,Twelve episodic tales in the life of a Parisian woman and her slow descent into prostitution.
742,Crimes and Misdemeanors,1989,PG-13,104,"Comedy, Drama            ",7.8,77        ,59231,18.25,An ophthalmologist's mistress threatens to reveal their affair to his wife while a married documentary filmmaker is infatuated with another woman.
743,Once Upon a Time in Anatolia,2011,Not Rated,157,"Crime, Drama, Thriller            ",7.8,82        ,47709,0.14,A group of men set out in search of a dead body in the Anatolian steppes.
744,Tokyo Godfathers,2003,PG-13,92,"Animation, Adventure, Comedy            ",7.8,74        ,42964,0.13,"On Christmas Eve, three homeless people living on the streets of Tokyo discover a newborn baby among the trash and set out to find its parents."
745,L'Avventura,1960,Not Rated,144,"Drama, Mystery, Romance            ",7.8,,31012,,"A woman disappears during a Mediterranean boating trip. During the search, her lover and her best friend become attracted to each other."
746,Veer Zaara,2004,Not Rated,192,"Drama, Family, Musical            ",7.8,67        ,54784,2.92,"""Veer-Zaara"" is a saga of love, separation, courage, and sacrifice. A love story that is an inspiration and will remain a legend forever."
747,My Life as a Zucchini,2016,PG-13,70,"Animation, Comedy, Drama            ",7.8,85        ,26916,0.29,"After losing his mother, a young boy is sent to an orphanage with other orphans his age where he begins to learn the meaning of trust and true love."
748,Knockin' on Heaven's Door,1997,Not Rated,87,"Action, Crime, Comedy            ",7.8,,31968,0.00,"Two terminally ill patients escape from a hospital, steal a car and rush towards the sea."
749,A Night at the Opera,1935,Passed,96,"Comedy, Music, Musical            ",7.8,,33638,2.54,A sly business manager and the wacky friends of two opera singers in Italy help them achieve success in America while humiliating their stuffy and snobbish enemies.
750,Hindi Medium,2017,Not Rated,132,"Comedy, Drama            ",7.8,,30369,,A couple from Chandni Chowk aspire to give their daughter the best education and thus be a part of and accepted by the elite of Delhi.
751,Vicky Donor,2012,Not Rated,126,"Comedy, Romance            ",7.8,,44259,0.17,"A man is brought in by an infertility doctor to supply him with his sperm, where he becomes the biggest sperm donor for his clinic."
752,English Vinglish,2012,Not Rated,134,"Comedy, Drama, Family            ",7.8,,37501,1.67,"A quiet, sweet tempered housewife endures small slights from her well-educated husband and daughter every day because of her inability to speak and understand English."
753,Avatar: The Way of Water,2022,PG-13,192,"Action, Adventure, Fantasy            ",7.7,67        ,371627,659.68,"Jake Sully lives with his newfound family formed on the extrasolar moon Pandora. Once a familiar threat returns to finish what was previously started, Jake must work with Neytiri and the army of the Na'vi race to protect their home."
754,The Whale,2022,R,117,Drama            ,7.7,60        ,137093,,"A reclusive, morbidly obese English teacher attempts to reconnect with his estranged teenage daughter."
755,The Banshees of Inisherin,2022,R,114,"Comedy, Drama            ",7.7,87        ,203221,,"Two lifelong friends find themselves at an impasse when one abruptly ends their relationship, with alarming consequences for both of them."
756,Evil Dead II,1987,R,84,"Comedy, Horror            ",7.7,72        ,171708,5.92,The lone survivor of an onslaught of flesh-possessing spirits holes up in a cabin with a group of strangers while the demons continue their attack.
757,Aftersun,2022,R,102,Drama            ,7.7,95        ,60048,,Sophie reflects on the shared joy and private melancholy of a holiday she took with her father twenty years earlier. Memories real and imagined fill the gaps between as she tries to reconcile the father she knew with the man she didn't...
758,Get Out,2017,R,104,"Horror, Mystery, Thriller            ",7.7,85        ,637283,176.04,"A young African-American visits his White girlfriend's parents for the weekend, where his simmering uneasiness about their reception of him eventually reaches a boiling point."
759,The Goonies,1985,PG,114,"Adventure, Comedy, Family            ",7.7,62        ,283969,61.50,A group of young misfits called The Goonies discover an ancient map and set out on an adventure to find a legendary pirate's long-lost treasure.
760,The Hangover,2009,R,100,Comedy            ,7.7,73        ,805147,277.32,"Three buddies wake up from a bachelor party in Las Vegas, with no memory of the previous night and the bachelor missing. They make their way around the city in order to find their friend before his wedding."
761,Ex Machina,2014,R,108,"Drama, Sci-Fi, Thriller            ",7.7,78        ,559789,25.44,A young programmer is selected to participate in a ground-breaking experiment in synthetic intelligence by evaluating the human qualities of a highly advanced humanoid A.I.
762,Empire of the Sun,1987,PG,153,"Drama, War            ",7.7,62        ,129564,22.24,A young English boy struggles to survive under Japanese occupation of China during World War II.
763,Harry Potter and the Goblet of Fire,2005,PG-13,157,"Adventure, Family, Fantasy            ",7.7,81        ,644722,290.01,"Harry Potter finds himself competing in a hazardous tournament between rival schools of magic, but he is distracted by recurring nightmares."
764,Man on Fire,2004,R,146,"Action, Crime, Drama            ",7.7,47        ,371031,77.91,"In Mexico City, a former CIA operative swears vengeance on those who committed an unspeakable act against the family he was hired to protect."
765,Coraline,2009,PG,100,"Animation, Drama, Family            ",7.7,80        ,241512,75.29,"An adventurous 11-year-old girl finds another world that is a strangely idealized version of her frustrating home, but it has sinister secrets."
766,Mission: Impossible - Fallout,2018,PG-13,147,"Action, Adventure, Thriller            ",7.7,86        ,343444,220.16,"Ethan Hunt and his IMF team, along with some familiar allies, race against time after a mission gone wrong."
767,Black Hawk Down,2001,R,144,"Action, Drama, History            ",7.7,74        ,405656,108.64,"The story of 160 elite U.S. soldiers who dropped into Mogadishu in October 1993 to capture two top lieutenants of a renegade warlord, but found themselves in a desperate battle with a large force of heavily armed Somalis."
768,Blue Is the Warmest Colour,2013,NC-17,180,"Drama, Romance            ",7.7,90        ,156782,2.20,"Adèle's life is changed when she meets Emma, a young woman with blue hair, who will allow her to discover desire and to assert herself as a woman and as an adult. In front of others, Adèle grows, seeks herself, loses herself, and ultimately finds herself through love and loss."
769,Kingsman: The Secret Service,2014,R,129,"Action, Adventure, Comedy            ",7.7,60        ,683676,128.26,"A spy organisation recruits a promising street kid into the agency's training program, while a global threat emerges from a twisted tech genius."
770,Wind River,2017,R,107,"Crime, Drama, Mystery            ",7.7,73        ,261299,33.80,A veteran hunter helps an FBI agent investigate the murder of a young woman on a Wyoming Native American reservation.
771,Home Alone,1990,PG,103,"Comedy, Family            ",7.7,63        ,602790,285.76,"An eight-year-old troublemaker, mistakenly left home alone, must defend his home against a pair of burglars on Christmas eve."
772,Airplane!,1980,PG,88,Comedy            ,7.7,78        ,247721,83.40,"After the crew becomes sick with food poisoning, a neurotic ex-fighter pilot must land a commercial airplane full of passengers safely."
773,Zodiac,2007,R,157,"Crime, Drama, Mystery            ",7.7,79        ,559321,33.08,"Between 1968 and 1983, a San Francisco cartoonist becomes an amateur detective obsessed with tracking down the Zodiac Killer, an unidentified individual who terrorizes Northern California with a killing spree."
774,Another Round,2020,Not Rated,117,"Comedy, Drama            ",7.7,79        ,172118,,Four high-school teachers consume alcohol on a daily basis to see how it affects their social and professional lives.
775,Blazing Saddles,1974,R,93,"Comedy, Western            ",7.7,73        ,144102,119.50,"In order to ruin a western town, a corrupt politician appoints a black Sheriff, who promptly becomes his most formidable adversary."
776,Detachment,2011,Not Rated,98,Drama            ,7.7,52        ,90738,0.07,A substitute teacher who drifts from classroom to classroom finds a connection to the students and teachers during his latest assignment.
777,The Game,1997,R,129,"Drama, Mystery, Thriller            ",7.7,63        ,407834,48.32,"After a wealthy San Francisco banker is given an opportunity to participate in a mysterious game, his life is turned upside down as he begins to question if it might really be a concealed conspiracy to destroy him."
778,The Color Purple,1985,PG-13,154,Drama            ,7.7,78        ,90008,98.47,A black Southern woman struggles to find her identity after suffering abuse from her father and others over four decades.
779,Training Day,2001,R,122,"Action, Crime, Drama            ",7.7,69        ,448706,76.63,A rookie cop spends his first day as a Los Angeles narcotics officer with a rogue detective who isn't what he appears to be.
780,Tangled,2010,PG,100,"Animation, Adventure, Comedy            ",7.7,71        ,467273,200.82,"The magically long-haired Rapunzel has spent her entire life in a tower, but now that a runaway thief has stumbled upon her, she is about to discover the world for the first time, and who she really is."
781,Ocean's Eleven,2001,PG-13,116,"Crime, Thriller            ",7.7,74        ,589434,183.42,Danny Ocean and his ten accomplices plan to rob three Las Vegas casinos simultaneously.
782,Primal Fear,1996,R,129,"Crime, Drama, Mystery            ",7.7,47        ,230870,56.12,"An altar boy is accused of murdering a priest, and the truth is buried several layers deep."
783,Blue Velvet,1986,R,120,"Crime, Drama, Mystery            ",7.7,76        ,205435,8.55,"The discovery of a severed human ear found in a field leads a young man on an investigation related to a beautiful, mysterious nightclub singer and a group of psychopathic criminals who have kidnapped her child."
784,The Count of Monte Cristo,2002,PG-13,131,"Action, Adventure, Drama            ",7.7,61        ,142146,54.23,"A young man, falsely imprisoned by his jealous ""friend"", escapes and uses a hidden treasure to exact his revenge."
785,Harry Potter and the Deathly Hallows: Part 1,2010,PG-13,146,"Adventure, Family, Fantasy            ",7.7,65        ,565818,295.98,"As Harry, Ron and Hermione race against time and evil to destroy the Horcruxes, they uncover the existence of the three most powerful objects in the wizarding world: the Deathly Hallows."
786,The Lego Movie,2014,PG,100,"Animation, Action, Adventure            ",7.7,83        ,367187,257.76,"An ordinary LEGO construction worker, thought to be the prophesied as ""special"", is recruited to join a quest to stop an evil tyrant from gluing the LEGO universe into eternal stasis."
787,Brokeback Mountain,2005,R,134,"Drama, Romance            ",7.7,87        ,366594,83.04,Ennis and Jack are two shepherds who develop a sexual and emotional relationship. Their relationship becomes complicated when both of them get married to their respective girlfriends.
788,Silver Linings Playbook,2012,R,122,"Comedy, Drama, Romance            ",7.7,81        ,720211,132.09,"After a stint in a mental institution, former teacher Pat Solitano moves back in with his parents and tries to reconcile with his ex-wife. Things get more challenging when Pat meets Tiffany, a mysterious girl with problems of her own."
789,Deliverance,1972,R,109,"Adventure, Drama, Thriller            ",7.7,80        ,113671,7.06,"Intent on seeing the Cahulawassee River before it's dammed and turned into a lake, outdoor fanatic Lewis Medlock takes his friends on a canoeing trip they'll never forget into the dangerous American back-country."
790,The Bourne Supremacy,2004,PG-13,108,"Action, Mystery, Thriller            ",7.7,73        ,472532,176.24,"When Jason Bourne is framed for a CIA operation gone awry, he is forced to resume his former life as a trained assassin to survive."
791,The Last of the Mohicans,1992,R,112,"Action, Adventure, Drama            ",7.7,76        ,176804,75.51,Three trappers protect the daughters of a British Colonel in the midst of the French and Indian War.
792,Lost in Translation,2003,R,102,"Comedy, Drama            ",7.7,91        ,466113,44.59,A faded movie star and a neglected young woman form an unlikely bond after crossing paths in Tokyo.
793,500 Days of Summer,2009,PG-13,95,"Comedy, Drama, Romance            ",7.7,76        ,528999,32.39,"After being dumped by the girl he believes to be his soulmate, hopeless romantic Tom Hansen reflects on their relationship to try and figure out where things went wrong and how he can win her back."
794,Argo,2012,R,120,"Biography, Drama, Thriller            ",7.7,86        ,623596,136.03,"Acting under the cover of a Hollywood producer scouting a location for a science fiction film, a CIA agent launches a dangerous operation to rescue six Americans in Tehran during the U.S. hostage crisis in Iran in 1979."
795,Road to Perdition,2002,R,117,"Crime, Drama, Thriller            ",7.7,72        ,275240,104.45,"A mob enforcer's son in 1930s Illinois witnesses a murder, forcing him and his father to take to the road, and his father down a path of redemption and revenge."
796,3:10 to Yuma,2007,R,122,"Action, Crime, Drama            ",7.7,76        ,319446,53.61,A small-time rancher agrees to hold a captured outlaw who's awaiting a train to go to court in Yuma. A battle of wills ensues as the outlaw tries to psych out the rancher.
797,And Your Mother Too,2001,R,106,Drama            ,7.7,89        ,125456,13.62,"In Mexico, two teenage boys and an attractive older woman embark on a road trip and learn a thing or two about life, friendship, sex, and each other."
798,Hamlet,1996,PG-13,242,Drama            ,7.7,,38933,4.41,"Hamlet, Prince of Denmark, returns home to find his father murdered and his mother remarrying the murderer, his uncle. Meanwhile, war is brewing."
799,First Blood,1982,R,93,"Action, Adventure, Thriller            ",7.7,61        ,261450,47.21,A veteran Green Beret is forced by a cruel Sheriff and his deputies to flee into the mountains and wage an escalating one-man war against his pursuers.
800,X-Men: First Class,2011,PG-13,131,"Action, Sci-Fi            ",7.7,65        ,703355,146.41,"In the 1960s, superpowered humans Charles Xavier and Erik Lensherr work together to find others like them, but Erik's vengeful pursuit of an ambitious mutant who ruined his life causes a schism to divide them."
801,Toy Story 4,2019,G,100,"Animation, Adventure, Comedy            ",7.7,84        ,260607,434.04,"When a new toy called ""Forky"" joins Woody and the gang, a road trip alongside old and new friends reveals how big the world can be for a toy."
802,Birdman or (The Unexpected Virtue of Ignorance),2014,R,119,"Comedy, Drama            ",7.7,87        ,644025,42.34,"A washed-up superhero actor attempts to revive his fading career by writing, directing, and starring in a Broadway production."
803,The Magnificent Seven,1960,Approved,128,"Action, Adventure, Drama            ",7.7,74        ,97955,4.91,Seven gunfighters are hired by Mexican peasants to liberate their village from oppressive bandits.
804,A Few Good Men,1992,R,138,"Drama, Thriller            ",7.7,62        ,272331,141.34,Military lawyer Lieutenant Daniel Kaffee defends Marines accused of murder. They contend they were acting under orders.
805,Crash,2004,R,112,"Crime, Drama, Thriller            ",7.7,66        ,441867,54.58,"Los Angeles citizens with vastly separate lives collide in interweaving stories of race, loss and redemption."
806,The Machinist,2004,R,101,"Drama, Thriller            ",7.7,61        ,399825,1.08,An industrial worker who hasn't slept in a year begins to doubt his own sanity.
807,The Boy in the Striped Pajamas,2008,PG-13,94,"Drama, War            ",7.7,55        ,228578,9.03,"Through the innocent eyes of Bruno, the eight-year-old son of the commandant at a German concentration camp, a forbidden friendship with a Jewish boy on the other side of the camp fence has startling and unexpected consequences."
808,Mr. Nobody,2009,R,141,"Drama, Fantasy, Romance            ",7.7,63        ,238451,0.00,"A boy stands on a station platform as a train is about to leave. Should he go with his mother or stay with his father? Infinite possibilities arise from this decision. As long as he doesn't choose, anything is possible."
809,As Good as It Gets,1997,PG-13,139,"Comedy, Drama, Romance            ",7.7,67        ,306582,148.48,"A single mother and waitress, a misanthropic author, and a gay artist form an unlikely friendship after the artist is assaulted in a robbery."
810,Apollo 13,1995,PG,140,"Adventure, Drama, History            ",7.7,77        ,302489,173.84,NASA must devise a strategy to return Apollo 13 to Earth safely after the spacecraft undergoes massive internal damage putting the lives of the three astronauts on board in jeopardy.
811,Midnight in Paris,2011,PG-13,94,"Comedy, Fantasy, Romance            ",7.7,81        ,433733,56.82,"While on a trip to Paris with his fiancée's family, a nostalgic screenwriter finds himself mysteriously going back to the 1920s every day at midnight."
812,Wreck-It Ralph,2012,PG,101,"Animation, Adventure, Comedy            ",7.7,72        ,435020,189.42,"A video game villain wants to be a hero and sets out to fulfill his dream, but his quest brings havoc to the whole arcade where he lives."
813,Gravity,2013,PG-13,91,"Drama, Sci-Fi, Thriller            ",7.7,96        ,839141,274.09,Two astronauts work together to survive after an accident leaves them stranded in space.
814,What's Eating Gilbert Grape,1993,PG-13,118,Drama            ,7.7,73        ,243445,9.17,A young man in a small Midwestern town struggles to care for his mentally-disabled younger brother and morbidly obese mother while attempting to pursue his own happiness.
815,"O Brother, Where Art Thou?",2000,PG-13,107,"Adventure, Comedy, Crime            ",7.7,69        ,319287,45.51,"In the deep south during the 1930s, three escaped convicts search for hidden treasure while a relentless lawman pursues them."
816,Halloween,1978,R,91,"Horror, Thriller            ",7.7,87        ,287930,47.00,"Fifteen years after murdering his sister on Halloween night 1963, Michael Myers escapes from a mental hospital and returns to the small town of Haddonfield, Illinois to kill again."
817,The Trial of the Chicago 7,2020,R,129,"Drama, History, Thriller            ",7.7,76        ,183303,,"The story of 7 people on trial stemming from various charges surrounding the uprising at the 1968 Democratic National Convention in Chicago, Illinois."
818,A Man Called Ove,2015,PG-13,116,"Comedy, Drama, Romance            ",7.7,70        ,62718,3.48,"Ove, an ill-tempered, isolated retiree who spends his days enforcing block association rules and visiting his wife's grave, has finally given up on life just as an unlikely friendship develops with his boisterous new neighbors."
819,The Boondock Saints,1999,R,108,"Action, Thriller            ",7.7,44        ,243027,0.03,Two Irish Catholic brothers become vigilantes and wipe out Boston's criminal underworld in the name of God.
820,Who Framed Roger Rabbit,1988,PG,104,"Animation, Adventure, Comedy            ",7.7,83        ,207320,156.45,A toon-hating detective is a cartoon rabbit's only hope to prove his innocence when he is accused of murder.
821,Being John Malkovich,1999,R,113,"Comedy, Drama, Fantasy            ",7.7,90        ,343156,22.86,A puppeteer discovers a portal that leads literally into the head of movie star John Malkovich.
822,Sound of Metal,2019,R,120,"Drama, Music            ",7.7,82        ,136084,,A heavy-metal drummer's life is thrown into freefall when he begins to lose his hearing.
823,Serpico,1973,R,130,"Biography, Crime, Drama            ",7.7,81        ,127543,29.80,An honest New York cop named Frank Serpico blows the whistle on rampant corruption in the force only to have his comrades turn against him.
824,The Fault in Our Stars,2014,PG-13,126,"Drama, Romance            ",7.7,69        ,386096,124.87,Two teenage cancer patients begin a life-affirming journey to visit a reclusive author in Amsterdam.
825,Sense and Sensibility,1995,PG,136,"Drama, Romance            ",7.7,84        ,119801,43.18,"Rich Mr. Dashwood dies, leaving his second wife and her three daughters poor by the rules of inheritance. The two eldest daughters are the title opposites."
826,Dirty Harry,1971,R,102,"Action, Crime, Thriller            ",7.7,87        ,161221,35.90,"When a man calling himself ""the Scorpio Killer"" menaces San Francisco, tough-as-nails Police Inspector ""Dirty"" Harry Callahan is assigned to track down the crazed psychopath."
827,Star Trek II: The Wrath of Khan,1982,PG,113,"Action, Adventure, Sci-Fi            ",7.7,68        ,124875,78.91,"With the assistance of the Enterprise crew, Admiral Kirk must stop an old nemesis, Khan Noonien Singh, from using the life-generating Genesis Device as the ultimate weapon."
828,When Harry Met Sally...,1989,R,95,"Comedy, Drama, Romance            ",7.7,76        ,227844,92.82,"Harry and Sally have known each other for years, and are very good friends, but they fear sex would ruin the friendship."
829,The Theory of Everything,2014,PG-13,123,"Biography, Drama, Romance            ",7.7,71        ,462559,35.89,A look at the relationship between the famous physicist Stephen Hawking and his wife.
