,Movie_Name,Year_of_Release,C_Rating,Watch_Time_(min),Genre,Movie_Rating,Metascore,Votes,Gross_($M),Description
0,The Shawshank Redemption,1994,R,142,Drama            ,9.3,82        ,2735235,28.34,"Over the course of several years, two convicts form a friendship, seeking consolation and, eventually, redemption through basic compassion."
1,The Godfather,1972,R,175,"Crime, Drama            ",9.2,100        ,1902109,134.97,The aging patriarch of an organized crime dynasty in postwar New York City transfers control of his clandestine empire to his reluctant youngest son.
2,The Dark Knight,2008,PG-13,152,"Action, Crime, Drama            ",9.0,84        ,2708419,534.86,"When the menace known as the Joker wreaks havoc and chaos on the people of Gotham, Batman must accept one of the greatest psychological and physical tests of his ability to fight injustice."
3,Schindler's List,1993,R,195,"Biography, Drama, History            ",9.0,95        ,1380843,96.90,"In German-occupied Poland during World War II, industrialist Oskar Schindler gradually becomes concerned for his Jewish workforce after witnessing their persecution by the Nazis."
4,The Lord of the Rings: The Return of the King,2003,PG-13,201,"Action, Adventure, Drama            ",9.0,94        ,1881383,377.85,Gandalf and Aragorn lead the World of Men against Sauron's army to draw his gaze from Frodo and Sam as they approach Mount Doom with the One Ring.
5,12 Angry Men,1957,Approved,96,"Crime, Drama            ",9.0,97        ,809518,4.36,The jury in a New York City murder trial is frustrated by a single member whose skeptical caution forces them to more carefully consider the evidence before jumping to a hasty verdict.
6,The Godfather Part II,1974,R,202,"Crime, Drama            ",9.0,90        ,1296679,57.30,"The early life and career of Vito Corleone in 1920s New York City is portrayed, while his son, Michael, expands and tightens his grip on the family crime syndicate."
7,Pulp Fiction,1994,R,154,"Crime, Drama            ",8.9,95        ,2101929,107.93,"The lives of two mob hitmen, a boxer, a gangster and his wife, and a pair of diner bandits intertwine in four tales of violence and redemption."
8,Inception,2010,PG-13,148,"Action, Adventure, Sci-Fi            ",8.8,74        ,2404179,292.58,"A thief who steals corporate secrets through the use of dream-sharing technology is given the inverse task of planting an idea into the mind of a C.E.O., but his tragic past may doom the project and his team to disaster."
9,Fight Club,1999,R,139,Drama            ,8.8,66        ,2177808,37.03,An insomniac office worker and a devil-may-care soap maker form an underground fight club that evolves into much more.
10,The Lord of the Rings: The Fellowship of the Ring,2001,PG-13,178,"Action, Adventure, Drama            ",8.8,92        ,1910207,315.54,A meek Hobbit from the Shire and eight companions set out on a journey to destroy the powerful One Ring and save Middle-earth from the Dark Lord Sauron.
11,Forrest Gump,1994,PG-13,142,"Drama, Romance            ",8.8,82        ,2128491,330.25,"The presidencies of Kennedy and Johnson, the Vietnam War, the Watergate scandal and other historical events unfold from the perspective of an Alabama man with an IQ of 75, whose only desire is to be reunited with his childhood sweetheart."
12,"The Good, the Bad and the Ugly",1966,Approved,178,"Adventure, Western            ",8.8,90        ,774990,6.10,A bounty hunting scam joins two men in an uneasy alliance against a third in a race to find a fortune in gold buried in a remote cemetery.
13,The Lord of the Rings: The Two Towers,2002,PG-13,179,"Action, Adventure, Drama            ",8.8,87        ,1698350,342.55,"While Frodo and Sam edge closer to Mordor with the help of the shifty Gollum, the divided fellowship makes a stand against Sauron's new ally, Saruman, and his hordes of Isengard."
14,Jai Bhim,2021,TV-MA,164,"Crime, Drama, Mystery            ",8.8,,206160,,"When a tribal man is arrested for a case of alleged theft, his wife turns to a human-rights lawyer to help bring justice."
15,777 Charlie,2022,,164,"Adventure, Comedy, Drama            ",8.8,,34505,,Dharma is stuck in a rut with his negative and lonely lifestyle and spends each day in the comfort of his loneliness. A pup named Charlie enters his life and gives him a new perspective towards it.
16,Rocketry: The Nambi Effect,2022,,157,"Biography, Drama            ",8.8,,52856,,"Based on the life of Indian Space Research Organization scientist Nambi Narayanan, who was framed for being a spy and arrested in 1994. Though free, he continues to fight for justice against the officials who falsely implicated him."
17,The Matrix,1999,R,136,"Action, Sci-Fi            ",8.7,73        ,1951328,171.48,"When a beautiful stranger leads computer hacker Neo to a forbidding underworld, he discovers the shocking truth--the life he knows is the elaborate deception of an evil cyber-intelligence."
18,Goodfellas,1990,R,145,"Biography, Crime, Drama            ",8.7,92        ,1187250,46.84,"The story of Henry Hill and his life in the mob, covering his relationship with his wife Karen Hill and his mob partners Jimmy Conway and Tommy DeVito in the Italian-American crime syndicate."
19,One Flew Over the Cuckoo's Nest,1975,R,133,Drama            ,8.7,84        ,1025777,112.00,"In the Fall of 1963, a Korean War veteran and criminal pleads insanity and is admitted to a mental institution, where he rallies up the scared patients against the tyrannical nurse."
20,Star Wars: Episode V - The Empire Strikes Back,1980,PG,124,"Action, Adventure, Fantasy            ",8.7,82        ,1316752,290.48,"After the Rebels are overpowered by the Empire, Luke Skywalker begins his Jedi training with Yoda, while his friends are pursued across the galaxy by Darth Vader and bounty hunter Boba Fett."
21,Soorarai Pottru,2020,TV-MA,153,"Action, Drama            ",8.7,,119230,,"Nedumaaran Rajangam ""Maara"" sets out to make the common man fly and in the process takes on the world's most capital intensive industry and several enemies who stand in his way."
22,Interstellar,2014,PG-13,169,"Adventure, Drama, Sci-Fi            ",8.6,74        ,1899101,188.02,A team of explorers travel through a wormhole in space in an attempt to ensure humanity's survival.
23,The Silence of the Lambs,1991,R,118,"Crime, Drama, Thriller            ",8.6,86        ,1462579,130.74,"A young F.B.I. cadet must receive the help of an incarcerated and manipulative cannibal killer to help catch another serial killer, a madman who skins his victims."
24,Se7en,1995,R,127,"Crime, Drama, Mystery            ",8.6,65        ,1691067,100.13,"Two detectives, a rookie and a veteran, hunt a serial killer who uses the seven deadly sins as his motives."
25,Star Wars: Episode IV - A New Hope,1977,PG,121,"Action, Adventure, Fantasy            ",8.6,90        ,1389219,322.74,"Luke Skywalker joins forces with a Jedi Knight, a cocky pilot, a Wookiee and two droids to save the galaxy from the Empire's world-destroying battle station, while also attempting to rescue Princess Leia from the mysterious Darth Vader."
26,The Green Mile,1999,R,189,"Crime, Drama, Fantasy            ",8.6,61        ,1330128,136.80,"The lives of guards on Death Row are affected by one of their charges: a black man accused of child murder and rape, yet who has a mysterious gift."
27,Spirited Away,2001,PG,125,"Animation, Adventure, Family            ",8.6,96        ,785976,10.06,"During her family's move to the suburbs, a sullen 10-year-old girl wanders into a world ruled by gods, witches and spirits, a world where humans are changed into beasts."
28,Saving Private Ryan,1998,R,169,"Drama, War            ",8.6,91        ,1418898,216.54,"Following the Normandy Landings, a group of U.S. soldiers go behind enemy lines to retrieve a paratrooper whose brothers have been killed in action."
29,Terminator 2: Judgment Day,1991,R,137,"Action, Sci-Fi            ",8.6,75        ,1119721,204.84,"A cyborg, identical to the one who failed to kill Sarah Connor, must now protect her 10-year old son John from an even more advanced and powerful cyborg."
30,City of God,2002,R,130,"Crime, Drama            ",8.6,79        ,768853,7.56,"In the slums of Rio, two kids' paths diverge as one struggles to become a photographer and the other a kingpin."
31,Life Is Beautiful,1997,PG-13,116,"Comedy, Drama, Romance            ",8.6,59        ,709034,57.60,"When an open-minded Jewish waiter and his son become victims of the Holocaust, he uses a perfect mixture of will, humor and imagination to protect his son from the dangers around their camp."
32,Seven Samurai,1954,Not Rated,207,"Action, Drama            ",8.6,98        ,351863,0.27,"Farmers from a village exploited by bandits hire a veteran samurai for protection, who gathers six other samurai to join him."
33,It's a Wonderful Life,1946,PG,130,"Drama, Family, Fantasy            ",8.6,89        ,470846,,An angel is sent from Heaven to help a desperately frustrated businessman by showing him what life would have been like if he had never existed.
34,Harakiri,1962,Not Rated,133,"Action, Drama, Mystery            ",8.6,85        ,60533,,"When a ronin requesting seppuku at a feudal lord's palace is told of the brutal suicide of another ronin who previously visited, he reveals how their pasts are intertwined - and in doing so challenges the clan's integrity."
35,Sita Ramam,2022,,163,"Action, Drama, Mystery            ",8.6,,59083,,"An orphan soldier, Lieutenant Ram's life changes, after he gets a letter from a girl named Sita. He meets her and love blossoms between them. When he comes back to his camp in Kashmir,After he gets caught in jail, he sends a letter to Sita which won't reach her."
36,Alien,1979,R,117,"Horror, Sci-Fi            ",8.5,89        ,900469,78.90,The crew of a commercial spacecraft encounter a deadly lifeform after investigating an unknown transmission.
37,Whiplash,2014,R,106,"Drama, Music            ",8.5,89        ,899037,13.09,A promising young drummer enrolls at a cut-throat music conservatory where his dreams of greatness are mentored by an instructor who will stop at nothing to realize a student's potential.
38,Gladiator,2000,R,155,"Action, Adventure, Drama            ",8.5,67        ,1530951,187.71,A former Roman General sets out to exact vengeance against the corrupt emperor who murdered his family and sent him into slavery.
39,Parasite,2019,R,132,"Drama, Thriller            ",8.5,96        ,847999,53.37,Greed and class discrimination threaten the newly formed symbiotic relationship between the wealthy Park family and the destitute Kim clan.
40,Back to the Future,1985,PG,116,"Adventure, Comedy, Sci-Fi            ",8.5,87        ,1233701,210.61,"Marty McFly, a 17-year-old high school student, is accidentally sent 30 years into the past in a time-traveling DeLorean invented by his close friend, the maverick scientist Doc Brown."
41,The Departed,2006,R,151,"Crime, Drama, Thriller            ",8.5,85        ,1351675,132.38,An undercover cop and a mole in the police attempt to identify each other while infiltrating an Irish gang in South Boston.
42,The Prestige,2006,PG-13,130,"Drama, Mystery, Sci-Fi            ",8.5,66        ,1360008,53.09,"After a tragic accident, two stage magicians in 1890s London engage in a battle to create the ultimate illusion while sacrificing everything they have to outwit each other."
43,Léon: The Professional,1994,R,110,"Action, Crime, Drama            ",8.5,64        ,1185121,19.50,"12-year-old Mathilda is reluctantly taken in by Léon, a professional assassin, after her family is murdered. An unusual relationship forms as she becomes his protégée and learns the assassin's trade."
44,The Lion King,1994,G,88,"Animation, Adventure, Drama            ",8.5,88        ,1081250,422.78,"Lion prince Simba and his father are targeted by his bitter uncle, who wants to ascend the throne himself."
45,Apocalypse Now,1979,R,147,"Drama, Mystery, War            ",8.5,94        ,680290,83.47,A U.S. Army officer serving in Vietnam is tasked with assassinating a renegade Special Forces Colonel who sees himself as a god.
46,The Pianist,2002,R,150,"Biography, Drama, Music            ",8.5,85        ,852565,32.57,A Polish Jewish musician struggles to survive the destruction of the Warsaw ghetto of World War II.
47,Psycho,1960,R,109,"Horror, Mystery, Thriller            ",8.5,97        ,685413,32.00,"A Phoenix secretary embezzles $40,000 from her employer's client, goes on the run and checks into a remote motel run by a young man under the domination of his mother."
48,The Usual Suspects,1995,R,106,"Crime, Drama, Mystery            ",8.5,77        ,1101697,23.34,"A sole survivor tells of the twisty events leading up to a horrific gun battle on a boat, which began when five criminals met at a seemingly random police lineup."
49,Casablanca,1942,PG,102,"Drama, Romance, War            ",8.5,100        ,581930,1.02,A cynical expatriate American cafe owner struggles to decide whether or not to help his former lover and her fugitive husband escape the Nazis in French Morocco.
50,American History X,1998,R,119,"Crime, Drama            ",8.5,62        ,1140458,6.72,A former neo-nazi skinhead tries to prevent his younger brother from going down the same wrong path that he did.
51,The Intouchables,2011,R,112,"Biography, Comedy, Drama            ",8.5,57        ,878474,13.18,"After he becomes a quadriplegic from a paragliding accident, an aristocrat hires a young man from the projects to be his caregiver."
52,Once Upon a Time in the West,1968,PG-13,165,Western            ,8.5,82        ,336169,5.32,A mysterious stranger with a harmonica joins forces with a notorious desperado to protect a beautiful widow from a ruthless assassin working for the railroad.
53,Grave of the Fireflies,1988,Not Rated,89,"Animation, Drama, War            ",8.5,94        ,285974,,A young boy and his little sister struggle to survive in Japan during World War II.
54,Cinema Paradiso,1988,R,155,"Drama, Romance            ",8.5,80        ,267483,11.99,A filmmaker recalls his childhood when falling in love with the pictures at the cinema of his home village and forms a deep friendship with the cinema's projectionist.
55,Rear Window,1954,PG,112,"Mystery, Thriller            ",8.5,100        ,500547,36.76,"A wheelchair-bound photographer spies on his neighbors from his Greenwich Village courtyard apartment window, and becomes convinced one of them has committed murder, despite the skepticism of his fashion-model girlfriend."
56,Modern Times,1936,G,87,"Comedy, Drama, Romance            ",8.5,96        ,247581,0.16,The Tramp struggles to live in modern industrial society with the help of a young homeless woman.
57,Kaithi,2019,Not Rated,145,"Action, Adventure, Crime            ",8.5,,35745,,"Dilli, an ex-convict, endeavours to meet his daughter for the first time after leaving prison. However, his attempts are interrupted due to a drug raid planned by Inspector Bejoy."
58,City Lights,1931,G,87,"Comedy, Drama, Romance            ",8.5,99        ,188075,0.02,"With the aid of a wealthy erratic tippler, a dewy-eyed tramp who has fallen in love with a sightless flower girl accumulates money to be able to help her medically."
59,96,2018,Not Rated,158,"Drama, Romance            ",8.5,,32992,,Two high school sweethearts meet at a reunion after 22 years and reminisce about their past.
60,Guardians of the Galaxy Vol. 3,2023,PG-13,150,"Action, Adventure, Comedy            ",8.4,65        ,27850,,"Still reeling from the loss of Gamora, Peter Quill rallies his team to defend the universe and one of their own - a mission that could mean the end of the Guardians if not successful."
61,Avengers: Endgame,2019,PG-13,181,"Action, Adventure, Drama            ",8.4,78        ,1172448,858.37,"After the devastating events of Avengers: Infinity War (2018), the universe is in ruins. With the help of remaining allies, the Avengers assemble once more in order to reverse Thanos' actions and restore balance to the universe."
62,Joker,2019,R,122,"Crime, Drama, Thriller            ",8.4,59        ,1345493,335.45,"The rise of Arthur Fleck, from aspiring stand-up comedian and pariah to Gotham's clown prince and leader of the revolution."
63,Spider-Man: Into the Spider-Verse,2018,PG,117,"Animation, Action, Adventure            ",8.4,87        ,558382,190.24,"Teen Miles Morales becomes the Spider-Man of his universe, and must join with five spider-powered individuals from other dimensions to stop a threat for all realities."
64,Raiders of the Lost Ark,1981,PG,115,"Action, Adventure            ",8.4,85        ,983391,248.16,"In 1936, archaeologist and adventurer Indiana Jones is hired by the U.S. government to find the Ark of the Covenant before the Nazis can obtain its awesome powers."
65,Your Name.,2016,PG,106,"Animation, Drama, Fantasy            ",8.4,79        ,284024,5.02,"Two strangers find themselves linked in a bizarre way. When a connection forms, will distance be the only thing to keep them apart?"
66,Aliens,1986,R,137,"Action, Adventure, Sci-Fi            ",8.4,84        ,730519,85.16,"Decades after surviving the Nostromo incident, Ellen Ripley is sent out to re-establish contact with a terraforming colony but finds herself battling the Alien Queen and her offspring."
67,Avengers: Infinity War,2018,PG-13,149,"Action, Adventure, Sci-Fi            ",8.4,68        ,1116359,678.82,The Avengers and their allies must be willing to sacrifice all in an attempt to defeat the powerful Thanos before his blitz of devastation and ruin puts an end to the universe.
68,Django Unchained,2012,R,165,"Drama, Western            ",8.4,81        ,1593233,162.81,"With the help of a German bounty-hunter, a freed slave sets out to rescue his wife from a brutal plantation owner in Mississippi."
69,The Shining,1980,R,146,"Drama, Horror            ",8.4,66        ,1045386,44.02,"A family heads to an isolated hotel for the winter where a sinister presence influences the father into violence, while his psychic son sees horrific forebodings from both past and future."
70,Oldboy,2003,R,120,"Action, Drama, Mystery            ",8.4,77        ,593886,0.71,"After being kidnapped and imprisoned for fifteen years, Oh Dae-Su is released, only to find that he must find his captor in five days."
71,The Dark Knight Rises,2012,PG-13,164,"Action, Drama, Thriller            ",8.4,78        ,1736204,448.14,"Eight years after the Joker's reign of chaos, Batman is coerced out of exile with the assistance of the mysterious Selina Kyle in order to defend Gotham City from the vicious guerrilla terrorist Bane."
72,Memento,2000,R,113,"Mystery, Thriller            ",8.4,81        ,1259953,25.54,A man with short-term memory loss attempts to track down his wife's murderer.
73,Come and See,1985,Not Rated,142,"Drama, Thriller, War            ",8.4,,85096,,"After finding an old rifle, a young boy joins the Soviet resistance movement against ruthless German forces and experiences the horrors of World War II."
74,Braveheart,1995,R,178,"Biography, Drama, History            ",8.4,68        ,1053302,75.60,Scottish warrior William Wallace leads his countrymen in a rebellion to free his homeland from the tyranny of King Edward I of England.
75,Das Boot,1981,R,149,"Drama, War            ",8.4,86        ,255067,11.49,A German U-boat stalks the frigid waters of the North Atlantic as its young crew experience the sheer terror and claustrophobic life of a submariner in World War II.
76,WALL·E,2008,G,98,"Animation, Adventure, Family            ",8.4,95        ,1138978,223.81,"In the distant future, a small waste-collecting robot inadvertently embarks on a space journey that will ultimately decide the fate of mankind."
77,Coco,2017,PG,105,"Animation, Adventure, Comedy            ",8.4,81        ,530545,209.73,"Aspiring musician Miguel, confronted with his family's ancestral ban on music, enters the Land of the Dead to find his great-great-grandfather, a legendary singer."
78,Amadeus,1984,R,160,"Biography, Drama, Music            ",8.4,88        ,408723,51.97,"The life, success and troubles of Wolfgang Amadeus Mozart, as told by Antonio Salieri, the contemporaneous composer who was deeply jealous of Mozart's talent and claimed to have murdered him."
79,The Lives of Others,2006,R,137,"Drama, Mystery, Thriller            ",8.4,89        ,395784,11.29,"In 1984 East Berlin, an agent of the secret police, conducting surveillance on a writer and his lover, finds himself becoming increasingly absorbed by their lives."
80,Capernaum,2018,R,126,Drama            ,8.4,75        ,94477,1.66,"While serving a five-year sentence for a violent crime, a 12-year-old boy sues his parents for neglect."
81,Dr. Strangelove or: How I Learned to Stop Worrying and Love the Bomb,1964,PG,95,"Comedy, War            ",8.4,97        ,499125,0.28,"An insane American general orders a bombing attack on the Soviet Union, triggering a path to nuclear holocaust that a war room full of politicians and generals frantically tries to stop."
82,Sunset Blvd.,1950,Passed,110,"Drama, Film-Noir            ",8.4,94        ,226258,,A screenwriter develops a dangerous relationship with a faded film star determined to make a triumphant return.
83,3 Idiots,2009,PG-13,170,"Comedy, Drama            ",8.4,67        ,409584,6.53,"Two friends are searching for their long lost companion. They revisit their college days and recall the memories of their friend who inspired them to think differently, even as the rest of the world called them ""idiots""."
84,Witness for the Prosecution,1957,Approved,116,"Crime, Drama, Mystery            ",8.4,76        ,129015,8.18,A veteran British barrister must defend his client in a murder trial that has surprise after surprise.
85,Paths of Glory,1957,Approved,88,"Drama, War            ",8.4,90        ,201665,,"After refusing to attack an enemy position, a general accuses the soldiers of cowardice and their commanding officer must defend them."
86,The Great Dictator,1940,G,125,"Comedy, Drama, War            ",8.4,,228094,0.29,Dictator Adenoid Hynkel tries to expand his empire while a poor Jewish barber tries to avoid persecution from Hynkel's regime.
87,High and Low,1963,Not Rated,143,"Crime, Drama, Mystery            ",8.4,90        ,47505,,An executive of a Yokohama shoe company becomes a victim of extortion when his chauffeur's son is kidnapped by mistake and held for ransom.
88,Sardar Udham,2021,TV-MA,164,"Biography, Crime, Drama            ",8.4,,43916,,A biopic detailing the 2 decades that Punjabi Sikh revolutionary Udham Singh spent planning the assassination of the man responsible for the Jallianwala Bagh massacre.
89,Asuran,2019,Not Rated,141,"Action, Drama            ",8.4,,31037,,"The teenage son of a farmer from an underprivileged caste kills a rich, upper caste landlord. Will the farmer, a loving father and a pacifist by heart, be able to save his hot-blooded son is the rest of the story."
90,Drishyam 2,2021,,152,"Crime, Drama, Thriller            ",8.4,,38884,,A gripping tale of an investigation and a family which is threatened by it. Will Georgekutty be able to protect his family this time?
91,Top Gun: Maverick,2022,PG-13,130,"Action, Drama            ",8.3,78        ,578672,718.73,"After thirty years, Maverick is still pushing the envelope as a top naval aviator, but must confront ghosts of his past when he leads TOP GUN's elite graduates on a mission that demands the ultimate sacrifice from those chosen to fly it."
92,Good Will Hunting,1997,R,126,"Drama, Romance            ",8.3,70        ,999442,138.43,"Will Hunting, a janitor at M.I.T., has a gift for mathematics, but needs help from a psychologist to find direction in his life."
93,Inglourious Basterds,2009,R,153,"Adventure, Drama, War            ",8.3,69        ,1486093,120.54,"In Nazi-occupied France during World War II, a plan to assassinate Nazi leaders by a group of Jewish U.S. soldiers coincides with a theatre owner's vengeful plans for the same."
94,Requiem for a Dream,2000,R,102,Drama            ,8.3,71        ,859232,3.64,The drug-induced utopias of four Coney Island people are shattered when their addictions run deep.
95,Heat,1995,R,170,"Action, Crime, Drama            ",8.3,76        ,671153,67.44,A group of high-end professional thieves start to feel the heat from the LAPD when they unknowingly leave a clue at their latest heist.
96,Scarface,1983,R,170,"Crime, Drama            ",8.3,65        ,862646,45.60,"In 1980 Miami, a determined Cuban immigrant takes over a drug cartel and succumbs to greed."
97,Star Wars: Episode VI - Return of the Jedi,1983,PG,131,"Action, Adventure, Fantasy            ",8.3,58        ,1073888,309.13,"After rescuing Han Solo from Jabba the Hutt, the Rebels attempt to destroy the second Death Star, while Luke struggles to help Darth Vader back from the dark side."
98,American Beauty,1999,R,122,Drama            ,8.3,84        ,1171211,130.10,A sexually frustrated suburban father has a mid-life crisis after becoming infatuated with his daughter's best friend.
99,A Clockwork Orange,1971,R,136,"Crime, Sci-Fi            ",8.3,77        ,845553,6.21,"In the future, a sadistic gang leader is imprisoned and volunteers for a conduct-aversion experiment, but it doesn't go as planned."
100,Full Metal Jacket,1987,R,116,"Drama, War            ",8.3,78        ,756448,46.36,A pragmatic U.S. Marine observes the dehumanizing effects the Vietnam War has on his fellow recruits from their brutal boot camp training to the bloody street fighting in Hue.
101,Eternal Sunshine of the Spotless Mind,2004,R,108,"Drama, Romance, Sci-Fi            ",8.3,89        ,1028249,34.40,"When their relationship turns sour, a couple undergoes a medical procedure to have each other erased from their memories for ever."
