,Movie_Name,Year_of_Release,C_Rating,Watch_Time_(min),Genre,Movie_Rating,Metascore,Votes,Gross_($M),Description
204,Sherlock Jr.,1924,Passed,45,"Action, Comedy, Romance            ",8.2,,52110,0.98,"A film projectionist longs to be a detective, and puts his meagre skills to work when he is framed by a rival for stealing his girlfriend's father's pocketwatch."
205,Vikram Vedha,2017,Not Rated,147,"Action, Crime, Drama            ",8.2,,47312,,"Vikram, a no-nonsense police officer, accompanied by Simon, his partner, is on the hunt to capture Vedha, a smuggler and a murderer. Vedha tries to change Vikram's life, which leads to a conflict."
206,Uri: The Surgical Strike,2019,Not Rated,138,"Action, Drama, History            ",8.2,,66565,4.19,"Indian army special forces execute a covert operation, avenging the killing of fellow army men at their base by a terrorist group."
207,Umberto D.,1952,Not Rated,89,Drama            ,8.2,92        ,26723,0.07,An elderly man and his dog struggle to survive on his government pension in Rome.
208,Bhaag Milkha Bhaag,2013,Not Rated,186,"Biography, Drama, Sport            ",8.2,,69647,1.63,"The truth behind the ascension of Milkha Singh, who was scarred by of the India-Pakistan partition."
209,Paan Singh Tomar,2012,Not Rated,135,"Action, Biography, Crime            ",8.2,,36979,0.04,"The story of Paan Singh Tomar, an Indian athlete and seven-time national steeplechase champion who becomes one of the most feared dacoits in Chambal Valley after his retirement."
210,The Exorcist,1973,R,122,Horror            ,8.1,81        ,419567,232.91,"When a teenage girl is possessed by a mysterious entity, her mother seeks the help of two priests to save her daughter."
211,The Help,2011,PG-13,146,Drama            ,8.1,62        ,471005,169.71,"An aspiring author during the civil rights movement of the 1960s decides to write a book detailing the African American maids' point of view on the white families for which they work, and the hardships they go through on a daily basis."
212,Prisoners,2013,R,153,"Crime, Drama, Mystery            ",8.1,70        ,741763,61.00,"When Keller Dover's daughter and her friend go missing, he takes matters into his own hands as the police pursue multiple leads and the pressure mounts."
213,The Grand Budapest Hotel,2014,R,99,"Adventure, Comedy, Crime            ",8.1,88        ,834882,59.10,"A writer encounters the owner of an aging high-class hotel, who tells him of his early years serving as a lobby boy in the hotel's glorious years under an exceptional concierge."
214,Ford v Ferrari,2019,PG-13,152,"Action, Biography, Drama            ",8.1,81        ,414841,117.62,American car designer Carroll Shelby and driver Ken Miles battle corporate interference and the laws of physics to build a revolutionary race car for Ford in order to defeat Ferrari at the 24 Hours of Le Mans in 1966.
215,Stand by Me,1986,R,89,"Adventure, Drama            ",8.1,75        ,415773,52.29,"After the death of one of his friends, a writer recounts a childhood journey with his friends to find the body of a missing boy."
216,Mad Max: Fury Road,2015,R,120,"Action, Adventure, Sci-Fi            ",8.1,90        ,1026361,154.06,"In a post-apocalyptic wasteland, a woman rebels against a tyrannical ruler in search for her homeland with the aid of a group of female prisoners, a psychotic worshiper and a drifter named Max."
217,The Big Lebowski,1998,R,117,"Comedy, Crime            ",8.1,71        ,824836,17.50,"Ultimate L.A. slacker Jeff ""The Dude"" Lebowski, mistaken for a millionaire of the same name, seeks restitution for a rug ruined by debt collectors, enlisting his bowling buddies for help while trying to find the millionaire's missing wife."
218,Pirates of the Caribbean: The Curse of the Black Pearl,2003,PG-13,143,"Action, Adventure, Fantasy            ",8.1,63        ,1149991,305.41,"Blacksmith Will Turner teams up with eccentric pirate ""Captain"" Jack Sparrow to save his love, the governor's daughter, from Jack's former pirate allies, who are now undead."
219,Hacksaw Ridge,2016,R,139,"Biography, Drama, History            ",8.1,71        ,546592,67.21,"World War II American Army Medic Desmond T. Doss, who served during the Battle of Okinawa, refuses to kill people and becomes the first man in American history to receive the Medal of Honor without firing a shot."
220,Gone Girl,2014,R,149,"Drama, Mystery, Thriller            ",8.1,79        ,1005331,167.77,"With his wife's disappearance having become the focus of an intense media circus, a man sees the spotlight turned on him when it's suspected that he may not be innocent."
221,Blade Runner,1982,R,117,"Action, Drama, Sci-Fi            ",8.1,84        ,785516,32.87,A blade runner must pursue and terminate four replicants who stole a ship in space and have returned to Earth to find their creator.
222,Jaws,1975,PG,124,"Adventure, Mystery, Thriller            ",8.1,87        ,621459,260.00,"When a killer shark unleashes chaos on a beach community off Cape Cod, it's up to a local sheriff, a marine biologist, and an old seafarer to hunt the beast down."
223,Logan,2017,R,137,"Action, Drama, Sci-Fi            ",8.1,77        ,784139,226.28,"In a future where mutants are nearly extinct, an elderly and weary Logan leads a quiet life. But when Laura, a mutant child pursued by scientists, comes to him for help, he must get her to safety."
224,The Wizard of Oz,1939,PG,102,"Adventure, Family, Fantasy            ",8.1,92        ,409164,2.08,"Young Dorothy Gale and her dog Toto are swept away by a tornado from their Kansas farm to the magical Land of Oz, and embark on a quest with three new friends to see the Wizard, who can return her to her home and fulfill the others' wishes."
225,Catch Me If You Can,2002,PG-13,141,"Biography, Crime, Drama            ",8.1,75        ,1016217,164.62,"Barely 21 yet, Frank is a skilled forger who has passed as a doctor, lawyer and pilot. FBI agent Carl becomes obsessed with tracking down the con man, who only revels in the pursuit."
226,Rocky,1976,PG,120,"Drama, Sport            ",8.1,70        ,596252,117.24,A small-time Philadelphia boxer gets a supremely rare chance to fight the world heavyweight champion in a bout in which he strives to go the distance for his self-respect.
227,The Terminator,1984,R,107,"Action, Sci-Fi            ",8.1,84        ,882806,38.40,"A human soldier is sent from 2029 to 1984 to stop an almost indestructible cyborg killing machine, sent from the same year, which has been programmed to execute a young woman whose unborn son is the key to humanity's future salvation."
228,The Handmaiden,2016,Not Rated,145,"Drama, Romance, Thriller            ",8.1,84        ,155959,2.01,"A woman is hired as a handmaiden to a Japanese heiress, but secretly she is involved in a plot to defraud her."
229,Harry Potter and the Deathly Hallows: Part 2,2011,PG-13,130,"Adventure, Family, Fantasy            ",8.1,85        ,897396,381.01,"Harry, Ron, and Hermione search for Voldemort's remaining Horcruxes in their effort to destroy the Dark Lord as the final battle rages on at Hogwarts."
230,Ratatouille,2007,G,111,"Animation, Adventure, Comedy            ",8.1,96        ,762437,206.45,A rat who can cook makes an unusual alliance with a young kitchen worker at a famous Paris restaurant.
231,Dead Poets Society,1989,PG,128,"Comedy, Drama            ",8.1,79        ,507488,95.86,Maverick teacher John Keating uses poetry to embolden his boarding school students to new heights of self-expression.
232,Trainspotting,1996,R,93,Drama            ,8.1,83        ,699422,16.50,"Renton, deeply immersed in the Edinburgh drug scene, tries to clean up and get out, despite the allure of the drugs and influence of friends."
233,Fargo,1996,R,98,"Crime, Thriller            ",8.1,86        ,690881,24.61,Minnesota car salesman Jerry Lundegaard's inept crime falls apart due to his and his henchmen's bungling and the persistent police work of the quite pregnant Marge Gunderson.
234,Inside Out,2015,PG,95,"Animation, Adventure, Comedy            ",8.1,94        ,733219,356.46,"After young Riley is uprooted from her Midwest life and moved to San Francisco, her emotions - Joy, Fear, Anger, Disgust and Sadness - conflict on how best to navigate a new city, house, and school."
235,Into the Wild,2007,R,148,"Adventure, Biography, Drama            ",8.1,73        ,633663,18.35,"After graduating from Emory University, top student and athlete Christopher McCandless abandons his possessions, gives his entire $24,000 savings account to charity and hitchhikes to Alaska to live in the wilderness. Along the way, Christopher encounters a series of characters that shape his life."
236,How to Train Your Dragon,2010,PG,98,"Animation, Action, Adventure            ",8.1,75        ,758533,217.58,"A hapless young Viking who aspires to hunt dragons becomes the unlikely friend of a young dragon himself, and learns there may be more to the creatures than he assumed."
237,"Lock, Stock and Two Smoking Barrels",1998,R,107,"Action, Comedy, Crime            ",8.1,66        ,593625,3.90,"Eddy persuades his three pals to pool money for a vital poker game against a powerful local mobster, Hatchet Harry. Eddy loses, after which Harry gives him a week to pay back 500,000 pounds."
238,Spotlight,2015,R,129,"Biography, Crime, Drama            ",8.1,93        ,480738,45.06,"The true story of how the Boston Globe uncovered the massive scandal of child molestation and cover-up within the local Catholic Archdiocese, shaking the entire Catholic Church to its core."
239,"Three Billboards Outside Ebbing, Missouri",2017,R,115,"Comedy, Crime, Drama            ",8.1,88        ,524095,54.51,A mother personally challenges the local authorities to solve her daughter's murder when they fail to catch the culprit.
240,Room,2015,R,118,"Drama, Thriller            ",8.1,86        ,430497,14.68,"A little boy is held captive in a room with his mother since his birth, so he has never known the world outside."
241,Before Sunrise,1995,R,101,"Drama, Romance            ",8.1,77        ,319036,5.54,"A young man and woman meet on a train in Europe, and wind up spending one evening together in Vienna. Unfortunately, both know that this will probably be their only night together."
242,Gran Torino,2008,R,116,Drama            ,8.1,72        ,787756,148.10,"After a Hmong teenager tries to steal his prized 1972 Gran Torino, a disgruntled, prejudiced Korean War veteran seeks to redeem both the boy and himself."
243,"Monsters, Inc.",2001,G,92,"Animation, Adventure, Comedy            ",8.1,79        ,928946,289.92,"In order to power the city, monsters have to scare children so that they scream. However, the children are toxic to the monsters, and after a child gets through, two monsters realize things may not be what they think."
244,Memories of Murder,2003,Not Rated,132,"Crime, Drama, Mystery            ",8.1,82        ,194527,0.01,"In a small Korean province in 1986, two detectives struggle with the case of multiple young women being found raped and murdered by an unknown culprit."
245,Platoon,1986,R,120,"Drama, War            ",8.1,92        ,422310,138.53,"Chris Taylor, a neophyte recruit in Vietnam, finds himself caught in a battle of wills between two sergeants, one good and the other evil. A shrewd examination of the brutality of war and the duality of man in conflict."
246,The Sound of Music,1965,G,172,"Biography, Drama, Family            ",8.1,63        ,243770,163.21,A young novice is sent by her convent in 1930s Austria to become a governess to the seven children of a widowed naval officer.
247,The Deer Hunter,1978,R,183,"Drama, War            ",8.1,86        ,345875,48.98,An in-depth examination of the ways in which the Vietnam War impacts and disrupts the lives of several friends in a small steel mill town in Pennsylvania.
248,12 Years a Slave,2013,R,134,"Biography, Drama, History            ",8.1,96        ,714086,56.67,"In the antebellum United States, Solomon Northup, a free black man from upstate New York, is abducted and sold into slavery."
249,Rush,2013,R,123,"Action, Biography, Drama            ",8.1,74        ,489680,26.95,The merciless 1970s rivalry between Formula One rivals James Hunt and Niki Lauda.
250,Barry Lyndon,1975,PG,185,"Adventure, Drama, War            ",8.1,89        ,173134,,An Irish rogue wins the heart of a rich widow and assumes her dead husband's aristocratic position in 18th-century England.
251,Stalker,1979,Not Rated,162,"Drama, Sci-Fi            ",8.1,83        ,138021,0.23,A guide leads two men through an area known as the Zone to find a room that grants wishes.
252,Raging Bull,1980,R,129,"Biography, Drama, Sport            ",8.1,90        ,361936,23.38,"The life of boxer Jake LaMotta, whose violence and temper that led him to the top in the ring destroyed his life outside of it."
253,Million Dollar Baby,2004,PG-13,132,"Drama, Sport            ",8.1,86        ,698459,100.49,A determined woman works with a hardened boxing trainer to become a professional.
254,Ben-Hur,1959,G,212,"Adventure, Drama            ",8.1,90        ,244612,74.70,"After a Jewish prince is betrayed and sent into slavery by a Roman friend in 1st-century Jerusalem, he regains his freedom and comes back for revenge."
255,Portrait of a Lady on Fire,2019,R,122,"Drama, Romance            ",8.1,95        ,98191,3.76,"On an isolated island in Brittany at the end of the eighteenth century, a female painter is obliged to paint a wedding portrait of a young woman."
256,My Neighbor Totoro,1988,G,86,"Animation, Comedy, Family            ",8.1,86        ,350918,1.11,"When two girls move to the country to be near their ailing mother, they have adventures with the wondrous forest spirits who live nearby."
257,Cool Hand Luke,1967,GP,127,"Crime, Drama            ",8.1,92        ,181153,16.22,"A laid back Southern man is sentenced to two years in a rural prison, but refuses to conform."
258,La haine,1995,Not Rated,98,"Crime, Drama            ",8.1,,180536,0.31,24 hours in the lives of three young men in the French suburbs the day after a violent riot.
259,In the Mood for Love,2000,PG,98,"Drama, Romance            ",8.1,87        ,156058,2.73,"Two neighbors form a strong bond after both suspect extramarital activities of their spouses. However, they agree to keep their bond platonic so as not to commit similar wrongs."
260,A Silent Voice: The Movie,2016,Not Rated,130,"Animation, Drama            ",8.1,78        ,88647,,"A young man is ostracized by his classmates after he bullies a deaf girl to the point where she moves away. Years later, he sets off on a path for redemption."
261,Hachi: A Dog's Tale,2009,G,93,"Biography, Drama, Family            ",8.1,,293806,,A college professor bonds with an abandoned dog he takes into his home.
262,Wild Tales,2014,R,122,"Comedy, Drama, Thriller            ",8.1,77        ,204370,3.11,Six short stories that explore the extremities of human behavior involving people in distress.
263,Before Sunset,2004,R,80,"Drama, Romance            ",8.1,90        ,272807,5.82,"Nine years after Jesse and Celine first met, they encounter each other again on the French leg of Jesse's book tour."
264,Network,1976,R,121,Drama            ,8.1,83        ,163042,,"A television network cynically exploits a deranged former anchor's ravings and revelations about the news media for its own profit, but finds that his message may be difficult to control."
265,"Paris, Texas",1984,R,145,Drama            ,8.1,81        ,110156,2.18,"Travis Henderson, an aimless drifter who has been missing for four years, wanders out of the desert and must reconnect with society, himself, his life, and his family."
266,The Seventh Seal,1957,Not Rated,96,"Drama, Fantasy            ",8.1,88        ,189343,,"A knight returning to Sweden after the Crusades seeks answers about life, death, and the existence of God as he plays chess against the Grim Reaper during the Black Plague."
267,The Iron Giant,1999,PG,86,"Animation, Action, Adventure            ",8.1,85        ,207765,23.16,A young boy befriends a giant robot from outer space that a paranoid government agent wants to destroy.
268,Amores Perros,2000,R,154,"Drama, Thriller            ",8.1,83        ,244869,5.38,"A horrific car accident connects three stories, each involving characters dealing with loss, regret, and life's harsh realities, all in the name of love."
269,Hotel Rwanda,2004,PG-13,121,"Biography, Drama, History            ",8.1,79        ,361233,23.53,"Paul Rusesabagina, a hotel manager, houses over a thousand Tutsi refugees during their struggle against the Hutu militia in Rwanda, Africa."
270,The Bridge on the River Kwai,1957,PG,161,"Adventure, Drama, War            ",8.1,87        ,225120,44.91,"British POWs are forced to build a railway bridge across the river Kwai for their Japanese captors in occupied Burma, not knowing that the allied forces are planning a daring commando raid through the jungle to destroy it."
271,Persona,1966,Not Rated,83,"Drama, Thriller            ",8.1,86        ,123157,,A nurse is put in charge of a mute actress and finds that their personae are melding together.
272,In the Name of the Father,1993,R,133,"Biography, Crime, Drama            ",8.1,84        ,179390,25.01,A man's coerced confession to an I.R.A. bombing he did not commit results in the imprisonment of his father as well. An English lawyer fights to free them.
273,The Man Who Shot Liberty Valance,1962,Approved,123,"Drama, Western            ",8.1,94        ,78743,,A senator returns to a Western town for the funeral of an old friend and tells the story of his origins.
274,All Quiet on the Western Front,1930,Passed,152,"Drama, War            ",8.1,91        ,65342,3.27,"A German youth eagerly enters World War I, but his enthusiasm wanes as he gets a firsthand view of the horror."
275,Rebecca,1940,Approved,130,"Drama, Film-Noir, Mystery            ",8.1,86        ,140456,4.36,A self-conscious woman juggles adjusting to her new role as an aristocrat's wife and avoiding being intimidated by his first wife's spectral presence.
276,Neon Genesis Evangelion: The End of Evangelion,1997,TV-MA,87,"Animation, Action, Drama            ",8.1,,58183,,Concurrent theatrical ending of the TV series Neon Genesis Evangelion (1995).
277,The Third Man,1949,Approved,93,"Film-Noir, Mystery, Thriller            ",8.1,97        ,174985,0.45,"Pulp novelist Holly Martins travels to shadowy, postwar Vienna, only to find himself investigating the mysterious death of an old friend, Harry Lime."
278,Mary and Max,2009,Not Rated,92,"Animation, Comedy, Drama            ",8.1,,180386,,"A tale of friendship between two unlikely pen pals: Mary, a lonely, eight-year-old girl living in the suburbs of Melbourne, and Max, a forty-four-year old, severely obese man living in New York."
279,Paper Moon,1973,PG,102,"Comedy, Crime, Drama            ",8.1,77        ,49530,30.93,"During the Great Depression, a con man finds himself saddled with a young girl who may or may not be his daughter, and the two forge an unlikely partnership."
280,On the Waterfront,1954,Approved,108,"Crime, Drama, Thriller            ",8.1,91        ,158159,9.60,"An ex-prize fighter turned New Jersey longshoreman struggles to stand up to his corrupt union bosses, including his older brother, as he starts to connect with the grieving sister of one of the syndicate's victims."
281,The Celebration,1998,R,105,Drama            ,8.1,82        ,89739,1.65,"At Helge's 60th birthday party, some unpleasant family truths are revealed."
282,PK,2014,Not Rated,153,"Comedy, Drama, Sci-Fi            ",8.1,,192549,10.62,An alien on Earth loses the only device he can use to communicate with his spaceship. His innocent nature and child-like questions force the country to evaluate the impact of there religious views on there people.
283,The Best Years of Our Lives,1946,Approved,170,"Drama, Romance, War            ",8.1,93        ,66849,23.65,"Three World War II veterans, two of them traumatized or disabled, return home to the American midwest to discover that they and their families have been irreparably changed."
284,Three Colors: Red,1994,R,99,"Drama, Mystery, Romance            ",8.1,100        ,106058,4.04,A model discovers a retired judge is keen on invading people's privacy.
285,Bajrangi Bhaijaan,2015,Not Rated,163,"Action, Adventure, Comedy            ",8.1,,91593,8.18,An Indian man with a magnanimous heart takes a young mute Pakistani girl back to her homeland to reunite her with her family.
286,The Grapes of Wrath,1940,Passed,129,Drama            ,8.1,96        ,95864,0.06,"An Oklahoma family, driven off their farm by the poverty and hopelessness of the Dust Bowl, joins the westward migration to California, suffering the misfortunes of the homeless in the Great Depression."
287,It Happened One Night,1934,Passed,105,"Comedy, Romance            ",8.1,87        ,106915,4.36,"A renegade reporter trailing a young runaway heiress for a big story joins her on a bus heading from Florida to New York, and they end up stuck with each other when the bus leaves them behind at one of the stops."
288,The 400 Blows,1959,Not Rated,99,"Crime, Drama            ",8.1,,121711,,"A young boy, left without attention, delves into a life of petty crime."
289,Sholay,1975,Not Rated,162,"Action, Adventure, Comedy            ",8.1,,56963,,"After his family is murdered by a notorious and ruthless bandit, a former police officer enlists the services of two outlaws to capture the bandit."
290,Wild Strawberries,1957,Not Rated,91,"Drama, Romance            ",8.1,88        ,109718,,"After living a life marked by coldness, an aging professor is forced to confront the emptiness of his existence."
291,Fanny and Alexander,1982,R,188,Drama            ,8.1,100        ,65317,4.97,"Two young Swedish children in the 1900s experience the many comedies and tragedies of their lively and affectionate theatrical family, the Ekdahls."
292,The Battle of Algiers,1966,Not Rated,121,"Drama, War            ",8.1,96        ,62203,0.06,"In the 1950s, fear and violence escalate as the people of Algiers fight for independence from the French government."
293,The Message,1976,PG,177,"Biography, Drama, History            ",8.1,,48918,,This epic historical drama chronicles the life and times of Prophet Muhammad and serves as an introduction to early Islamic history.
294,Yi Yi: A One and a Two...,2000,Not Rated,173,"Drama, Romance            ",8.1,94        ,26082,1.14,Each member of a middle-class Taipei family seeks to reconcile past and present relationships within their daily lives.
295,A Woman Under the Influence,1974,R,155,"Drama, Romance            ",8.1,88        ,26639,13.34,"Although wife and mother Mabel is loved by her husband Nick, her mental illness places a strain on the marriage."
296,Winter Sleep,2014,Not Rated,196,Drama            ,8.1,88        ,52965,0.17,A hotel owner and landlord in a remote Turkish village deals with conflicts within his family and a tenant behind on his rent.
297,Mr. Smith Goes to Washington,1939,Passed,129,"Comedy, Drama            ",8.1,73        ,117377,9.60,"A naive youth leader is appointed to fill a vacancy in the U.S. Senate. His idealistic plans promptly collide with corruption at home and subterfuge from his hero in Washington, but he tries to forge ahead despite attacks on his character."
298,The Red Shoes,1948,Not Rated,135,"Drama, Music, Romance            ",8.1,,36692,10.90,A young ballet dancer is torn between the man she loves and her pursuit to become a prima ballerina.
299,The Hidden Fortress,1958,Not Rated,126,"Action, Adventure, Drama            ",8.1,89        ,40329,,"Lured by gold, two greedy peasants unknowingly escort a princess and her general across enemy lines."
300,Andrei Rublev,1966,R,205,"Biography, Drama, History            ",8.1,,55060,0.10,"The life, times and afflictions of the fifteenth-century Russian iconographer St. Andrei Rublev."
301,Farewell My Concubine,1993,R,171,"Drama, Music, Romance            ",8.1,83        ,30689,5.22,Two boys meet at an opera training school in Peking in 1924. Their resulting friendship will span nearly 70 years and will endure some of the most troublesome times in China's history.
302,Lagaan: Once Upon a Time in India,2001,PG,224,"Drama, Musical, Sport            ",8.1,84        ,116727,0.07,The people of a small village in Victorian India stake their future on a game of cricket against their ruthless British rulers.
303,Inherit the Wind,1960,Passed,128,"Biography, Drama, History            ",8.1,75        ,31327,,"Based on a real-life case in 1925, two great lawyers argue the case for and against a Tennessee science teacher accused of the crime of teaching evolution."
304,Wolf Children,2012,PG,117,"Animation, Drama, Family            ",8.1,71        ,46719,,"After her werewolf lover unexpectedly dies in an accident while hunting for food for their children, a young woman must find ways to raise the werewolf son and daughter that she had with him while keeping their trait hidden from society."
305,Throne of Blood,1957,Not Rated,110,Drama            ,8.1,,53681,,"A war-hardened general, egged on by his ambitious wife, works to fulfill a prophecy that he would become lord of Spider's Web Castle."
306,Diabolique,1955,Not Rated,117,"Crime, Drama, Horror            ",8.1,,67238,1.09,The wife and mistress of a loathed school principal plan to murder him with what they believe is the perfect alibi.
307,Underground,1995,Not Rated,167,"Comedy, Drama, Fantasy            ",8.1,79        ,59530,0.17,"A group of Serbian socialists prepares for the war in a surreal underground filled by parties, tragedies, love, and hate."
